{
  "$schema": "http://json-schema.org/draft-07/schema#",
  "$id": "https://vlp.invalid/schemas/events/ContractExpired.schema.json",
  "title": "ContractExpired",
  "description": "48시간(설정) 안에 승인되지 않아 만료됐다. (명명: PascalCase, 실행계획서 5장. lifecycle_event와의 통일 여부는 JEFLIX [미결])",
  "type": "object",
  "properties": {
    "eventId": {
      "type": "string",
      "format": "uuid"
    },
    "eventType": {
      "const": "ContractExpired"
    },
    "version": {
      "const": 1
    },
    "occurredAt": {
      "type": "string",
      "format": "date-time"
    },
    "contractId": {
      "type": "string",
      "format": "uuid"
    },
    "deliveryId": {
      "oneOf": [
        {
          "type": "string",
          "format": "uuid"
        },
        {
          "type": "null"
        }
      ]
    },
    "actor": {
      "type": "object",
      "properties": {
        "role": {
          "type": "string",
          "enum": [
            "customer",
            "karmaster",
            "shop",
            "admin",
            "system"
          ]
        },
        "userId": {
          "type": "string",
          "minLength": 1
        }
      },
      "required": [
        "role",
        "userId"
      ],
      "additionalProperties": false
    },
    "payload": {
      "type": "object",
      "properties": {
        "expiredAt": {
          "type": "string",
          "format": "date-time"
        }
      },
      "required": [
        "expiredAt"
      ],
      "additionalProperties": false
    }
  },
  "required": [
    "eventId",
    "eventType",
    "version",
    "occurredAt",
    "contractId",
    "deliveryId",
    "actor",
    "payload"
  ],
  "additionalProperties": false
}